pid	text
5	一个对哈佛大学,圣十字和东北大学篮球运动员的研究报道表明,在训练前和训练间含喝2.43克的胆碱酒石酸氢盐和果汁的混合饮料,与活力,精力的增加和疲劳的减少正相关。另外,跑马拉松的人也能从胆碱补充剂中受益,因为在进行两个小时的剧烈运动后血液中胆碱的水会相对降低,虽然服用胆碱补充剂不能立竿见影的增加你的速度或耐力,但还是有一定帮助的。<br>服用胆碱补充剂之前,需要务必意识到,高水平的胆碱可能会导致腹泻,肠胃气胀和身体出现鱼腥味。胆碱对儿童,所有年龄段的青少年和成人来说至关重要,对孕妇尤其重要,但摄入正确的计量是同样重要的。胆碱摄入量指导,参见莱纳斯鲍林研究所最佳的健康微量元素研究。<br>我们在eVtiamins为你精心准备了各种胆碱补充剂,和其他健康生活的必备补充!<br>更多健康资讯请继续关注我们,感谢您的阅读,我们下周见!
6	胆碱是一种人体必不可少的微量元素,各种体内重要生理功能和身体健康里都扮演着重要的角色。为了保持最佳的健康状况,下面介绍一些增加胆碱摄入,避免缺乏的方法。<br><img><br>虽然它并不是一般意义上的“维生素”,但胆碱是一种身体里必不可少的微量元素。健康的肝脏功能和大脑的发育保健都依赖于胆碱,因而它对孕妇尤其重要。作为一种神经递质前体,胆碱对细胞膜的正常和有效运作来说是不可或缺的,它同时还对降低血液中同型半胱氨酸水平和消炎起着至关重要的作用。此外,胆碱对大脑中产生某些关键化合物和保持神经信号传递很重要。并且胆碱也可以有利于运动员的变现,特别是在力量训练和耐力训练上。让我们仔细看看胆碱对健康的身心是如此关键的一些原因,并从中找出提高你的摄入方法。<br>胆碱不足的症状<br>没有一个健康的胆碱摄入量,那你可能会出现一些特定的胆碱不足症状。威尔博士指出,由于它会影响你的大脑,低于正常水平的胆碱会表现注意力分散,专注力不足,记忆力下降甚者痴呆的问题。健康的胆碱水平很重要的另一个原因是不能从饮食中摄入足够的胆碱容易促使脂肪肝的形成。孕妇胆碱不足可能导致胎儿出现特定的生理缺陷或大脑发育异常。为了避免出现任何由于缺乏胆碱引发的问题,男性应保持至少每天550毫克的胆碱摄入,而女性应保持大约425毫克, 才符合美国国家科学院指南的推荐量。
7	<br>胆碱的食物来源<br>你的胆碱水平通常是由你的饮食决定的,某些食物尤其富含卵磷脂形式的营养。最常见的的胆碱的来源之一是鸡蛋,牛肉和鸡肝,西兰花、小麦胚芽、鳕鱼、虾,鲑鱼也拥有大量的胆碱。更形象的让你了解推荐摄入量,三盎司的煎牛肝可以提供355毫克的胆碱,而一个大的鸡蛋约含有126毫克。<br>胆碱补充剂<br>虽然你从饮食中吸收大多数的胆碱,但胆碱补充剂也还可以提供帮助。如果你不喜欢肝脏或鸡蛋,或任何上面所提到的食物,那么服用胆碱补充剂可以帮助保持健康的肝脏功能并降低血同型半胱氨酸促进心血管功能。此外,补充胆碱可以保健你的大脑,甚至某些类型的运动员还能中获益。
9	电影 3 中 的擎天柱仍然变形为大家已经很 熟悉的 Peterbilt 350 拖车,不同 的是,这一次他终于拥有了最具 标志性的重型装备——卡车拖箱。 擎天柱闪亮的尾部,虽然他这次 的出场不再那么倜傥 全新配备的卡车拖箱不仅可 以储存大量武器装备,更可以变 形为飞行装甲,帮助擎天柱展翅 翱翔,完全掌握制空权! 1 擎天柱展翅翱翔,帅死了 2、铁皮(Ironhide) 身为擎天柱的贴身护卫和挚友, 铁皮是最可靠的武器专家。 在真人电影 3 部曲中, 铁皮全程沿用了 GMC 的 Topkick 6500 的造型,给人以威猛而忠诚的感觉。 2 武器专家铁皮在本集中命运多舛,大家自己想吧 在前两作中,铁皮英勇顽强、大开大阖的作战风格给我们留下了深刻印象。在电影 3 中,他将保持自 己“老兵”的身份设定,忠于职守、关爱同袍。铁皮就像是汽车人里的猛张飞。而邪恶的敌人也深深知道这 一点…… 3、救护车(Ratchet) 真人电影系列中,救死扶伤的博派军医救护车被扫描成了悍马急救车的外形,使这位妙手回春的治疗(修 理?)高手更增添了几分军人的雄壮气概。 在电影前两集中,救护车既要坚持治疗大黄蜂的失语症,又要密切监测山姆小朋友的内分泌指数,还 要随时准备治疗受伤的同胞。 枪林弹雨中少不了他迂回前进的身影, 一有机会还得为擎天柱准备飞行马甲, 真是忙得不亦乐乎。相信第 3 集里他还会继续忙碌下去,因为战火仍在蔓延。 3 4、大黄蜂(Bumblebee) 从电影 1 开始, 大黄蜂就以其可爱的形象、 风趣的“对白”和矫健的动作吸引了绝大多数观众的注意力。 成为变形金刚电影系列中当仁不让的大明星和吉祥物。身为侦察兵战士的大黄蜂同时也是人类的好朋友, 他和山姆和米凯拉等人之间的友情为我们留下了很多温馨难忘的回忆。在新的一集中,体贴的大黄蜂仍免 不了还要为山姆的个人感情问题忙前跑后,出谋划策。 大 黄蜂每一集都在更新形象 大黄蜂同时还是时尚的代言人,每一次在新的电影作品中大黄蜂都会以科迈罗(Camaro)轿车的最新型 号闪亮登场。电影 3 亦不例外。除了外观华丽的新车型之外,大黄蜂更多了一样本事:可以在车辆模式下 变形显露出各式重型武器装备, 从而得以在车辆模式下直接开战, 而不必非得变成机器人才能投入战斗。 (这 一设定也令人不禁想起《太空堡垒》系列中介于人机之间的“守护者模式”。) 4 5、横炮(Sideswipe) 博派战士横炮与霸天虎有着不共戴天的深仇大恨,所以他在战场上无比凶猛,甚至不惜违抗军令。不 过在平时,他变形为一辆帅气的银色雪佛兰考维特黄貂鱼百年(Corvette StingRay)概念跑车,行动敏捷, 略带狂野,时髦指数满分! 在电影 1 的时候横炮还没有来到地球。电影 2 里一开始就锋芒毕露,以雷霆万钧之势,飞轮快刀痛斩 边路。而到了第 3 集,横炮在外形方面更上一层楼,改装为敞篷跑车。同时远程武器的加入,也令横炮杀 伤力大增,成为博派军中一员虎将。 5 横炮的变形状态 6.神行太保,上旋,路霸 原型车:雪佛兰 Impala 纳斯卡赛车 6 除了各式各样的超跑和名角之外,三辆被命名为 NASCAR trio(纳斯卡三重奏)也是影片的一大看点,这三辆 车原来只在动画中出现过, 它们的原型是分三种颜色的雪佛兰 Impala 赛车版, 经由雪佛兰纳斯卡赛车改装 就变成了另类的战车,看看尾部硕大的喷气孔就可见它的动力会有多么骇人了。据悉,这三辆车属于霸天 虎阵营中的飞虎队组织,他们和其他几个机器人可以合体成飞天虎。 7 这就是《变形金刚 2》里那个猥琐的“转轮” 7、转轮(Wheelie) 电影 2 中登场的转轮是一个小型机器人,即 使变形,也是变成一辆玩具大脚车。转轮本是狂 派霸天虎派来的奸细,然而经过女主角一番“感 化”,弃暗投明加入了博派。除了起到推动剧情 的作用之外,转轮的伶俐与搞怪也让影院里增添 了不少笑声。在第三集里,机灵活泼的转轮成了 山姆的好朋友(或者说宠物),戏份自然多多。与 此同时,他还多了一个同为赛星机器人的小伙伴, 会是谁呢? “转轮”和“脑脑”在山姆的阳台上相依为命 。“脑脑”在片中起了很关键的作用哦 8 8、脑脑(Brains) 电影 3 预告片中,出现了一个前所未见的的小家伙。他的造型完全是个科学家的样子,喜欢吃螺丝, 而且常常因为想太多而导致身体过热、冒烟。他就是电影 3 中转轮的新搭档,有着一个可爱的名字——“脑 脑(Brains)”。虽然电影 2 里的双胞胎“刹车”、“挡泥板”在电影 3 中不复出现,但相信这对新的双子组合仍可 为观众们带来许多欢乐。和转轮一样,“脑脑”也是个“反骨仔”,原本他是霸天虎带到地球来的机械工人,但 为了追求自由的生活,他逃离了狂派的控制,又误打误撞加入了汽车人的博派阵营。“脑脑”的变形模式是 一台笔记本电脑。 “暴龙”角色设定图 9、暴龙(Dino) 电影 3 里终于出现了欧系 名车——法拉利的身影,他就 是博派战士暴龙(Dino)。火红 的着色,流线的车身,再配上 意大利风味的口音,这位汽车 人的新战士处处透着那么个性 化。当变形为机器人的时候, 他手臂上的两只巨爪令人望而 生畏,想必其战斗风格也是同 样的凶猛暴烈吧。 “暴龙”的变形状态是法拉利 9 10、Q 博士(Que) Q 博士是《变形金刚 3》中新登场的一位博派智将 Q 博士的形象看起来就是一位聪明绝顶的科学家 Q 博士是电影 3 中新登场的一位博派智将,变形为一辆蓝色的 Benz E550。变成机器人的时候,他的 形象看起来就是一位聪明绝顶的科学家。这个人物的设定原型活脱脱其实就是博派科学家千斤顶。因为他 和千斤顶一样,都喜欢钻研战争科技,搞出一些军事小发明,与战友们分享。在电影 3 中,Q 博士的发明 虽然不像千斤顶那么多,但绝对能起到至关重要的作用。 10 10、御天敌(Sentinel Prime) 很久很久以前,在赛伯坦星球上,擎天柱和威震天曾是情同手足的师兄弟。而他们的老师,正是那饱 受尊敬的老汽车人——御天敌。御天敌是赛伯坦文明社会的缔造者,是擎天柱的前任领袖。御天敌曾经结 束了赛伯坦部族分裂的混乱局面,用科技和仁爱带来了和平富足。然而邪恶霸天虎帝国的崛起却令美好的 生活化为乌有,御天敌的飞船也被炸毁,远离赛星飞向了宇宙。 御天敌的变形状态 在电影 3 中, 擎天柱终于找回了恩师, 并用领导模块将其救活。 在地球上, 御天敌变形为一辆救火车。 然而他真的能够扑灭这四处蔓延的战火吗?他所拥有的能够拯救赛伯坦星球的神秘武器究竟是什么呢?这 将是电影 3 中最关键的秘密!同时这也意味着,御天敌是电影 3 中无比重要的一位大人物。 雷霆拯救队 12-13、雷霆拯救队(Wreckers) 电影 3 里面,博派汽车人的战力大增,新登场的战车三兄弟以其狰狞的外形,火爆的战法大展雄伟。他们 在一起是不可战胜的,他们在一起,就组成了雷霆拯救队。 雷霆拯救队的三位成员是路霸(Roadbuster)、 上旋(Topspin)和灌铅脚(Leadfoot), 分别变形为绿色、 蓝色和红色的 NASCAR 赛车。顾名思义,雷霆拯救队是博派军中一支具有超高人气的不二劲旅,最擅长以 雷霆万钧之势横扫强敌。在电影 3 中,他们变形为机器人的情况不太多。每当投入战斗的时候,他们的车 辆模式表面将会被各种长枪短炮所包裹,成为名副其实的移动军火库。 11 14、威震天(Megatron) 说起来,狂派首领威震天在电影系列中属于比较悲情的人物。电影 1 中威震天被冰冻了好多年, 好不容易抢到火种源却被爆胸而死,深埋大海。电影 2 中威震天被忠诚的部下救活,并按照故主堕落者的 吩咐吸收恒星能量,没想到复活的擎天柱率队杀到,打死了堕落者还炸毁了老威的半边脸 12 威震天的伪装模式 到了电影 3,威震天只能忍辱负重,一边养育赛星人的后代,一边以 Meck 货车的伪装模式狼狈偷生。 面对再度携手的御天敌和擎天柱,老威又将何去何从?别忘了,威震天曾经也是御天敌手下的得意爱徒。 这三个人之间的关系复杂着呢…… 红蜘蛛 15、红蜘蛛(Starscream) 狂派副官红蜘蛛继续沿用前作中 F-22 战机的造型。 在电影 1 和电影 2 中, 阴险自负的红蜘蛛总是辜 负威震天的寄托,不停地功败垂成。其实和其他变形金刚系列作品相比,电影系列里的红蜘蛛可以算是对 威震天陛下最为忠心耿耿的了,任劳任怨,知冷知热。而且基本上就没怎么见他造反,实在是太忠顺了。 13 红蜘蛛继续出色上演自己阴险狡诈的戏份 电影 3 中的红蜘蛛继续出色上演自己阴险狡诈的戏份。在狂派对人类与博派联军的战斗中大施杀手, 绝不留情。第 3 集中,红蜘蛛讲与强大的人类战士山姆展开单挑对决——如此实力悬殊的厮杀,结果将会 是怎样呢? 16-17、声波(Soundwave)/激光鸟(Laserbeak) 如果说红蜘蛛是威震天副官的话,声波绝对就是狂派的军师了。作为威震天最忠诚的部下之一,声波永远 用最少的语言、最有效的方法,收获最多的情报。 在前两集中,声波一直以人造卫星的模式在天外游荡,收集信息,调动部队。到了第 3 集,决战的炮 火即将打响,声波也耐不住寂寞地跑到了地面上,从观望者变成了恶狠狠的战士。 声波的小弟——激光鸟 14 声波永远用最少的语言、最有效的方法,收获最多的情报 既然提到了声波,自然也要介绍一下他的小弟——激光鸟(Laserbeak)。前两部电影中大展威风的 机器狗在电影 2 中被大黄蜂残忍地杀害了,于是第 3 部中激光鸟前来报仇。激光鸟历来都是狂派霸天虎资 深间谍之一。在电影 3 中,激光鸟以造型怪异的外星机器鸟形象出现。同时也可变形为机器人以及其他诡 异的伪装模式,种种惊喜,就留给观众到看电影的时候去发现吧…… 18-19、震荡波(Shockwave)/利钻魔(The Driller) 威风凛凛的震荡波总是圆睁着他那仅有的一只眼睛,像传说中的独眼巨人一般冷酷地面对仇敌。早在 御天敌率众平息部族争斗的时候,震荡波就结识了狂派霸主威震天。在威震天堕落地球北极不久,震荡波 也紧随其后坠落到了西伯利亚冰原上。多年之后,震荡波被威震天召唤重返狂派队伍。高深莫测的震荡波 将会扮演怎样的角色?他算是忠心耿耿,还是另有野心?或者只是来地球打打酱油? 除了强大的个人战力令人惊畏, 从震荡波身后还浮现出了恐怖巨型生物的阴影……这便是震荡波的宠物利钻 魔(Driller),他是一只来自远古赛星的机械巨怪,即便是赛伯坦星球上的强力战士,也无法凭一己之力将其 击败。电影 3 中震荡波带着它降临地球,必将掀起一番滔天大祸! 15 震荡波的角色设定图 16 震荡波的宠物利钻魔 路障在《变形金刚 3》中再次亮相 路障在《变形金刚 1》中首次亮相 20、路障(Barricade) 在电影 1 中曾经多次拼命苦战的路障,平日里惯用警车的外形隐藏自己,实际上却坏事做绝。然而电 影 1 结束之后,路障便销声匿迹。有人猜测路障已经战死。但实际上在多种电影漫画中路障仍然不辞辛劳 地四处作恶。 到了电影 3,路障终于再度回归主流战场,和狂派大部队一起投身于摧毁都市的大破坏活动中。不过 这一次,他还会继续保持“杀不死”的记录吗?但如果连强大的汽车人都杀不死他,还有谁能呢? 17 恐惧战队(Dreads)的战斗状态 21-23、恐惧战队(Dreads) 恐惧战队是电影 3 中狂派方面新登场的战斗小队,由曲轴箱(Crankcase)、短柄斧(Hatchet)、撬棍 (Crowbar)三名成员组成。他们拥有铁血战士般的狂野外形,战斗中狂狠毒辣,不择手段,将狂派作风体现 得淋漓尽致,成为狂派部队狂攻猛战的尖刀突击队。 恐惧站队变形后的雪佛兰 Suburban SUV 和路障一样,恐惧战队的成员们也选择变形为警用车辆。不过他们的块头比路障要大一些,三人都是 变形为雪佛兰 Suburban SUV。 伊戈尔是《变形金刚 3》中新出现的由威震天养育的狂派幼体 恐惧战队(Dreads) 18 24、伊戈尔(Igor) 伊戈尔是《变形金刚 3》中新出现的由威震天养育的狂派幼体。从电影设定图来看,他似乎只是一个 孤零零的脑袋而已。很难想象他将在电影中发挥怎样的作用。(阿福) 19
11	很多公司职位要求最低是本科那么我们的自考学历也就可以入选获得再然后就是各自凭借自己的能力了面试机会学历是个敲门砖并不一定是能力的表现各位加油~不要问我为什么这么好心我只是以一个过来人的身份希望看到这篇文章的同学少走点弯路能来问我的都是有缘人希望可以帮到你们谢谢~
12	各个阶段提升学历的最佳选择方法(中专升专科、中专升本科、高中升专科、高中升本科、专科升本科)各个阶段提升学历的最佳方法一、中专、中专升专科中专在读:可以通过单招考试考入专科(和高考同一性质主要针对中职学生考上也是统招)可以通过高考(难度大需要学习高中课程)可以通过自考可以通过成人高考中专已经毕业自考成人高考、中专升本科中专在读可以通过单招考试考入本科(难度比较大一般单招考上的都是专科)单招考试考入专科后可以通过自考考本科可以通过单招考试考入本科(难度比较大一般单招考上的都是专科)单招考试考入专科后可以通过统招专升本(又称专升本、专接本、专插本)考入本科这种方法最后需要去本科院校再读年录取率太低而且很多存在暗箱操作有关系就好办中专毕业自考成人高考提醒很多同学都以为全日制的最好这里要分清楚全日制的类别如果是高考考入的专科或者本科那么自然是全日制也是最好的如果是要参加自考、成人高考如果还在学校也有时间那么也可以去读全日制的成教、自考只是花费的学费较多最后的毕业证和业余制的一样如果已经工作那就完全没必要可以读业余制边工作边学习拿到的毕业证同样国家认可这里想说的是不要以为全日制的就一定好要看清楚自己的状况和全日制的学历性质否则只会白白浪费金钱和时间精力二、高中、高中升专科高中在读高中在读的话还是建议老老实实的学习复习努力参加高考吧如果学不进也建议不要放弃高考毕竟这是最好的考入统招大学的途径当然你也可以直接选择成人高考和自考全日制但仍然建议把高考考完再看高中毕业几年了自考成人高考、高中升本科高中在读同样的最好办法高考如果考上本科那自然最好如果考到统招专科也无妨可以在大一的时候参加自学考试升入本科高考完毕后成绩不理想可以选择读成人高考然后次年套读自考本科俗称专套本高中毕业几年了先报名参加成人高考然后次年套读自考本科都是业余制工作考试两不误也是最好的选择方法提醒高中在读最好参加高考后看情况高考完毕后只要能上统招专科就上统招专科不要傻傻的被一些招生老师拉去读了所谓全日制的成教和自考上了专科以后再考虑升本科三、专科升本科、目前统招专科在读大一的时候或者大二参加自学考试升本科在毕业的时候就可以同时拿到专科和本科毕业证以及本科学士学位(自考本科越早报名越好不要像我一样工作后才开始报名时间不够)大三下半学期可以参加统招专升本(又称专升本、专接本、专插本)考入本科这种方法最后需要去本科院校再读年录取率太低要求也比较严格不能跨省、跨专业而且很多存在暗箱操作提前预定好了名额有关系就好办、专科毕业(无论是成教、自考专科还是统招专科)自考本科自最好的选择成教专科即次之提醒专科升本科最好的途径还是通过自学考试含金量还是比较高的可以考公务员、研究生如果非要等着大三下半学期参加统招专升本也无妨统招专升本除了上面所说只有一次机会考不上那就只能再考自考本科只是这个时候已经毕业要工作可能时间又很紧最后提醒很多同学一上来就说我要读全日制但却很多东西都不了解这里要分清楚全日制的类别如果是高考考入的专科或者本科那么自然是全日制也是最好的如果是要参加自考、成人高考如果还在学校也有时间那么也可以去读全日制的成教、自考只是花费的学费较多最后的毕业证和业余制的一样如果已经工作那就完全没必要可以读业余制边工作边学习拿到的毕业证同样国家认可这里想说的是不要以为全日制的就一定好要看清楚自己的状况和全日制的学历性质否则只会白白浪费金钱和时间精力其实说句实话哪些统招本科全日制学生不一定学到多少东西只是拿到一个文凭而已我们自考生也不一定比他们差一样可以学到比他们更多的知识能下定决心参加自考的我相信都是吃苦、勤奋、努力之人将来也一定可以有所作为。
14	如对您有帮助,可购买打赏,谢谢 桂苓散的功效与作用 药用价值 用法用量 导语:桂苓散怎么吃?桂苓散虽为中医的一味方剂,但对很多疾病都 是有治疗效果的,那么根据不同的疾病,桂苓散应该怎么吃呢?下面 为大家揭晓答案。 桂苓散怎么吃?桂苓散虽为中医的一味方剂,但对很多疾病都是有 治疗效果的,那么根据不同的疾病,桂苓散应该怎么吃呢?下面为大 家揭晓答案。 【处方】芍药 30 钱,茯苓 30 钱,当归 15 钱,干姜 10 钱,桂心 10 钱,甘草 5 钱。 【制法】上为散。 【功能主治】心腹动悸,诸药不效者。 【用法用量】每服 1 钱,白汤送下,日 2 夜 1。 【摘录】 《名家方选》 【处方】半夏 4 钱,桂心 3 钱,甘草 3 钱,赤茯苓 4 两,泽泻 4 两。 【制法】上为散。 【功能主治】翻胃发渴。 【用法用量】每服 4 钱,加生姜,水煎服。 【摘录】 《得效》卷五 【处方】茯苓 2 两(锉) ,桂 1 分。 【制法】上为细末。 【功能主治】伤寒。 【用法用量】每服 2 钱,粥饮调下,1 日 2-3 次,不拘时候。每服 药后,饮沸汤,或粥饮 1 盏或半盏为佳。 【摘录】 《普济方》卷一四七引《保生回车论》 看完了上文
24	1.准备气球。 2.选择气球颜色。 3.制作完成。<br>
25	想必有很多的朋友们都不是特别的清楚吧,那么今天我就为大家详细介绍一下吧,以上意见仅供参考,不足之处请留言。<br>第一步,我们要准备好五颜六色的气球,接着是打气筒,或者就采用心形的气球就可以,一吹即可成型。<br>气球都准备好,选择好自己喜欢的颜色,准备好,大家记住一点,咱们吹长气球的时候一定要留个长尾巴。<br>然后会发现两个气球尾部交叉的中间,在气球的中点的左右两边各取一小段,用手将他们捏到一起。。这样一来的话,等待一会儿时间,就会成为一个弯曲的形状。这个步骤我们多尝试几次,捏住的部分越长,弯曲度越大。<br>最后按照我们的步骤,漂亮的心形气球就制作完成了,大家可以多做几个,越多越好看,大家可以按照我说的步骤操作下。<br>
