pid	text
153251	<img><br>一个一个的泡泡怎么能变成爱心呢 ,今天我们来教大家用长条编出一颗小爱心。<br>图片:20180916_214555_728.jpg<br><img><br>材料:260长条两根 气筒一个<br>图片:20180916_214555_698.jpg<br><img><br>详细制作步骤:<br>第一根红色尾端留18CM不充气<br>图片:20180916_214555_699.jpg<br><img><br>第一根紫色尾端留14CM不充气<br>图片:20180916_214555_700.jpg<br><img><br>两根系一起<br>图片:20180916_214555_701.jpg<br><img><br>紫色:22222 322222 1<br>红色:11122 1 22111 3<br>以上为紫色与红色扭泡泡泡泡个数<br>图片:20180916_214555_702.jpg<br><img><br>紫色留两个2指单泡泡与红色扭一个1指单泡泡相互交叉在一起<br>图片:20180916_214555_703.jpg<br><img><br>如图所示<br>图片:20180916_214555_704.jpg<br><img><br>紫色留两个2指单泡泡<br>图片:20180916_214555_705.jpg<br><img><br>红色扭一个1指单泡泡<br>图片:20180916_214555_706.jpg<br><img><br>紫色留两个2指单泡泡与红色扭一个1指单泡泡相互交叉在一起<br>图片:20180916_214555_707.jpg<br><img><br>如图所示<br>图片:20180916_214555_708.jpg<br><img><br>紫色留两个2指单泡泡<br>图片:20180916_214555_709.jpg<br><img><br>红色扭一个1指单泡泡<br>图片:20180916_214555_710.jpg<br><img><br>紫色红色单泡泡相互交叉在一起<br>图片:20180916_214555_711.jpg<br><img><br>紫色留两个2指单泡泡<br>图片:20180916_214555_712.jpg<br><img><br>红色留两个2指单泡泡与紫色相互交叉再一起<br>图片:20180916_214555_713.jpg<br><img><br>紫色留两个2指单泡泡<br>图片:20180916_214555_714.jpg<br><img><br>红色留两个2指单泡泡<br>图片:20180916_214555_715.jpg<br><img><br>红色与紫色2指单泡泡相互交叉再一起<br>图片:20180916_214555_716.jpg<br><img><br>外圈扭三个单泡泡<br>图片:20180916_214555_717.jpg<br><img><br>内圈扭一个单泡泡<br>图片:20180916_214555_718.jpg<br><img><br>互相转2圈,第三部分完成。口诀:31<br>图片:20180916_214555_719.jpg<br><img><br>接下来左边的一半爱心与右边一样,只不过是到这编织的。<br>口诀:2222313131<br>图片:20180916_214555_720.jpg<br><img><br>外圈扭一个单泡泡,吧剩下的去掉<br>图片:20180916_214555_721.jpg<br><img><br>将外圈最后一个单泡泡与第一个单泡泡汇合系在一起<br>图片:20180916_214555_722.jpg<br><img><br>汇合完成图<br>图片:20180916_214555_723.jpg<br><img><br>内圈再扭三个泡泡<br>图片:20180916_214555_724.jpg<br><img><br>准备与起点第一个单泡泡汇合<br>图片:20180916_214555_725.jpg<br><img><br>汇合完成图<br>图片:20180916_214555_726.jpg<br><img><br>将内圈气球去掉<br>图片:20180916_214555_727.jpg<br><img><br>爱心口诀:<br>外圈:22222 3 22222 1<br>内圈:11122 1 22111 3<br>图片:20180916_214555_728.jpg
153794	维吾尔木卡姆按流行地区和风格特色,可分为南疆木卡姆、北疆木卡姆、刀郎木卡姆、哈密木卡姆、吐鲁番木卡姆等等多种。每一种木卡姆有6至12套。人们常说的十二木卡姆,是指南疆木卡姆,是由12部大型古典套曲组成,每一部套曲又包括“穷乃合曼”、“达斯坦”和“麦西热甫”这3个大部分。“穷乃合曼”从散板序唱开始进行,紧接是慢速的太孜,到热烈的赛乃姆和大赛勒克,末尾以轻快的太喀特结束,其中有歌曲和舞曲,各曲间有间奏曲。“达斯·坦”由3到6首叙事歌组成,曲间有完整的间奏曲,音乐由慢而快,曲调相当流畅。“麦西热甫”由3至6首节拍不同的舞蹈歌曲组成,曲间无间奏曲,情绪热烈而奔放。十二木卡姆共有歌曲、乐曲260首,全部演唱一遍需要20多个小时。伴奏乐器有萨它尔(主唱者自拉自唱)、弹布林、热瓦甫、都它尔、丈介克、卡龙、小手鼓等等。<br>北疆木卡姆:是公元19世纪由南疆传入,也有12套。除没有“穷乃合曼”之外,结构与南疆木卡姆相同。音乐比较明快,主演唱者用弹布林或者萨它尔。而哈密木卡姆流行于东疆的哈密地区。与南、北疆木卡姆相比较,风格结构不尽相同。它由短小的散序起唱,接着演唱系列短小的歌曲和歌舞曲,无间奏曲。它也有12套,称哈密十二木卡姆。其伴奏乐器有哈密艾介克(似中胡)、刀郎热瓦甫、手鼓等。全部歌曲有262首,从头演唱一遍约需12个小时。
159474	<br><img><br>【重新获取取件码】<br>1、首先来到丰巢快递柜前,点击屏幕上的【取快递】;<br><img><br>2、然后选择取件码取件;<br><img><br>3、在输入取件码的右下方,有一个【忘记取件码】,点击;<br><img><br>4、然后输入快递使用的手机号码,点击“获取验证码”,验证码输入后,点击【下一步】;<br><img><br>5、可以看到当前柜机中存放的快递信息,点击右上角的【取件】,将快递取出即可。<br><img>
159475	<img><br>丰巢快递柜的取件码丢了、失效了、取件码错误,可以使用其他的方式进行取件,或者重新获取取件码取件:<br>【微信扫码取件】<br>1、首先打开手机中的微信,然后在消息界面点击右上角的搜索;<br><img><br>2、然后输入“丰巢智能柜”,点击搜索 ,选择搜索出来的丰巢智能柜公众号;<br><img><br>3、点击“关注公众号”;<br><img><br>4、然后将我们快递上填写的手机号码输入发送,绑定手机号码;<br><img><br>5、然后在丰巢快递柜,点击上方的【取快递】;<br><img><br>6、在丰巢快递柜取快递界面,可以选择微信扫码取件;<br><img><br>7、微信扫码成功,之后快递柜会自动打开我们快递所存放的柜子,取出快递后将柜门闭关即可,取出后,丰巢快递APP、微信公众号会提示我们的快递已从快递柜取出。
159984	我在我们这医院生的,顺产1500元,抱销200,还有1300元,这个是公立的,
165270	说明:引用此文请注明出处,并务请保留后面的有效链接地址,谢谢!<br>wide与widely用法的三点区别<br>本站特约作者陈仁祯<br>两者均可用作副词,区别如下:<br>区别1wide用作副词主要表示“张大”“睁大”到最大程度,侧重指物体从一边到另一边的距离(联系其形容词用法),通常与wide, apart等连用。如:<br>Open your mouth wide.把口张开。<br>The door was wide open.门敞开着。<br>He was standing with his feet wide apart.他站在那儿,两脚分开的距离很大。<br>区别2widely则主要表示距离远、范围大、地域广等,通常连用过去分词。如:<br>He has traveled widely.他曾在广泛地区旅行。<br>The most widely distributed is the Hui people.分布最广的是回族。<br>Gas is now widely used for cooking and heating.现在普遍用煤气烧饭和取暖。<br>That the attempt to save her had failed soon became widely known.想救她而未救成,此事不久已尽人皆知。<br>有时也连用某些表示差异或变化的词语(如different, differing, range, vary等)。如:<br>The conversation ranged widely.谈话内容十分广泛。<br>Prices vary widely from shop to shop.各家商店价格悬殊很大。<br>Society is made up of people of widely differing abilities.社会是由能力迥异的人组成的。<br>区别3在wide awake(完全醒着)这一习语中,一般不用widely。如:<br>In bed he lay wide awake.他睡意全无地躺在床上。<br>引用地址:
166314	<br>wifi万能钥匙pc版安装步骤<br>1、在PC下载网下载wifi万能钥匙pc版的压缩包,解压后,双击exe文件,进入安装界面,点击自定义安装<br><img><br>2、点击更改目录可以自由设置软件的安装位置,建议大家选择安装在D盘<br><img><br>3、点击立即安装<br><img><br>4、wifi万能钥匙pc版正在安装,我们耐心等待<br><img><br>5、软件安装成功,点击完成即可运行软件<br><img><br>wifi万能钥匙pc版使用方法<br>设置向导<br>1、当用户首次打开时,会自动进入的设置向导,单击中间的“开始向导”进行设置。<br><img><br>2、在第一步中,用户需要从列表中选择想要使用的无线网卡型号,必须保证无线网卡已经连接在电脑主机上。选中后,点击下方的“下一步”。<br><img><br>3、在第二步中,用户根据习惯来选择是否将已经连接上的WiFi共享出去,这样能够让其他用户更加方便的链接WiFi。选择完成后点击“下一步”。<br><img><br>4、在第三步中,用户可以了解建议的使用教程。用户需要将手机通过USB线连接到电脑上,并切换到调试模式。然后在电脑端的中点击“一键查询万能钥匙”来搜索周围可用的WiFi。得到搜索结果后,如果该WiFi可以连接,则会在后面出现一个蓝色钥匙按钮,再点击这个WiFi进行连接即可。最后点击“完成”结束设置。<br><img><br><img><br>wifi万能钥匙pc版常见问题<br><h3>1、为什么要使用WiFi万能钥匙(PC客户端)?</h3><br>WiFi万能钥匙(PC客户端)是一款笔记本电脑、台式机(带有无线网卡)等必备的搜索连接管理WiFi热点的工具。内置千万条的WiFi热点数据;用户可分享使用已知的Wi-Fi热点信息,支持网页认证一键连接,方便省心。<br><h3>2、什么是万能钥匙自动解锁?</h3><br>若该加密Wi-Fi热点已共享,则可以使用万能钥匙进行连接使用;若该加密Wi-Fi热点尚未共享,则您可以共享该热点。<br><h3>3、为什么WiFi万能钥匙PC版在没有联网的情况下要连接手机才能一键查询万能钥匙?</h3><br>因为在没有网络的情况下,WiFi万能钥匙PC客户端无法从云端下载被共享的WiFi密码,就无法查询到万能钥匙,所以就不能自动解锁该热点。当电脑连接手机之后,电脑可以通过手机2G/3G网络或者手机已经连接的WiFi网络来查询万能钥匙,然后通过手机传给电脑,实现电脑的WiFi连接。<br>wifi万能钥匙pc版更新日志<br>1. 修正WiFi链接服务端通讯错误;<br>2. 更新WiFi万能钥匙云端密码数据库;<br>3. 优化中文WiFi热点解锁bug;<br>4. 其他优化
166315	<img><br><img><br>wifi万能钥匙pc版官方版终于正式上线,wifi万能钥匙作为wifi产品手机端一款非常具有代表的wif共享软件,不负期望也终于是有了PC版本,WiFi万能钥匙是一款自动获取周边免费Wi-Fi热点信息并建立连接的无线必备工具。 所有的热点信息基于云端数据库,内置全国数万Wi-Fi热点数据,随时随地轻松接入无线网络,最大化使用各种联网的移动服务,扫除无网断网的状态,不过PC版必须有驱动才可以使用。<br><img><br>wifi万能钥匙pc版软件功能<br>云端:基于云端的Wi-Fi热点数据库,内置逾数十万条的热点数据,遍<br>布全国各地。<br>省电:创新的Wi-Fi一键省电功能,屏幕锁定或无网络传输状态,智能关闭Wi-Fi功能,省电又省心。<br>分享:用户可分享已知的Wi-Fi的热点信息也可使用万能钥匙获取其他用户分享的热点信息。<br>轻便:支持网页认证一键连接,解除反复输入的困扰。状态栏图标的显示,方便跟踪Wi-Fi热点的信号与流量。
169362	根据《重庆市高级人民法院关于开展机动车交通事故责任纠纷案件人身损害赔偿标准城乡统一试点工作的意见》(渝高法[2020]58号)规定,即日起,重庆地区机动车交通事故责任纠纷案件中残疾赔偿金、死亡赔偿金均按照新标准40006元/年进行计算、被扶养人生活费均按照新标准26464元/年进行计算。<br>江苏地区<br><img><br><img><br>2021年1月21日,江苏省高级人民法院公布 2020年度江苏省人身损害赔偿标准,2020年度江苏省全省居民人均工资性收入24657元、人均经营净收入5703元,全省平均负担系数1.84,2020年度江苏省全省居民人均生活消费支出26225元。根据《江苏省高级人民法院关于开展人身损害赔偿标准城乡统一试点工作的实施方案》规定,经计算,残疾/死亡赔偿金最新标准为55862.4元/年。即日起,江苏地区人身损害赔偿案件中残疾赔偿金、死亡赔偿金均按照新标准55862.4元/年进行计算。<br>浙江一般地区(除宁波)<br><img><br>2021年1月19日,国家统计局浙江调查总队公布 2020年度浙江省居民收入及支出收据,其中全体居民人均可支配收入52397元、全体居民人均消费支出31295元。目前,浙江地区均已试点统一人身损害赔偿标准,除宁波市试点按照宁波市城镇居民人均可支配收入、城镇居民人均消费性支出标准计算残疾/死亡赔偿金、被扶养人生活费以外,其余地市均试点按照浙江省全体居民人均可支配收入、全体居民人均消费支出计算残疾/死亡赔偿金、被扶养人生活费。即日起,除宁波市以外,浙江地区人身损害赔偿案件中残疾赔偿金、死亡赔偿金均按照新标准52397元/年进行计算、被扶养人生活费均按照新标准31295元/年进行计算。<br>浙江宁波地区<br><img><br>2021年1月26日,宁波市统计局、国家统计局宁波调查队公布 2020年度宁波市居民收入及支出数据,其中城镇居民人均可支配收入68008元、城镇居民人均生活消费支出38702元。根据《浙江省宁波市中级人民法院关于开展人身损害赔偿标准城乡统一试点工作通知》(甬中法内传〔2019〕92号)规定,即日起,宁波地区人身损害赔偿案件中残疾赔偿金、死亡赔偿金均按照新标准68008元/年进行计算、被扶养人生活费均按照新标准38702元/年进行计算。<br>内蒙古地区<br><img><br>2021年1月20日,内蒙古自治区统计局公布 2020年度内蒙古自治区城镇居民人均可支配收入41353元,根据《内蒙古自治区高级人民法院关于开展人身损害赔偿标准城乡统一试点工作的实施意见》规定,即日起,内蒙古地区人身损害赔偿案件中残疾赔偿金、死亡赔偿金均按照新标准41353元/年进行计算。<br>广西地区<br><img><br>2021年1月20日,广西壮族自治区统计局公布 2020年度全区城镇居民人均可支配收入35859元、全区城镇居民人均消费支出20907元,根据《广西壮族自治区高级人民法院关于开展人身损害赔偿标准城乡统一试点工作的通知》(桂高法网传〔2019〕105 号)规定,即日起,广西地区人身损害赔偿案件中残疾赔偿金、死亡赔偿金均按照新标准35859元/年进行计算、被扶养人生活费均按照新标准20907元/年进行计算。<br>安徽地区<br><img><br>2021年1月20日,安徽省统计局公布2020年度安徽省城镇居民人均可支配收入39442元,2021年1月21日,国家统计局安徽调查总队公布2020年度安徽省城镇居民人均消费性支出22683元。根据《安徽省高级人民法院关于开展人身损害赔偿标准城乡统一试点实施方案》(皖高法[2019]112号)规定,即日起,安徽地区人身损害赔偿案件中残疾赔偿金、死亡赔偿金均按照新标准39442元/年进行计算、被扶养人生活费均按照新标准22683元/年进行计算。<br>陕西地区<br><img><br>2021年1月20日,陕西省统计局公布 2020年度陕西省城镇居民人均可支配收入37868元/年,根据《陕西省高级人民法院关于在全省机动车事故责任纠纷案件中统一适用城镇居民人身损害赔偿标准的意见(试行)》规定,即日起,陕西地区人机动车事故责任纠纷案件中残疾赔偿金、死亡赔偿金均按照新标准37868元/年进行计算。<br>山东地区<br><img><br>2021年1月19日,山东省统计局公布 2020年度山东省城镇居民人均可支配收入43726元,根据《山东省高级人民法院关于开展人身损害赔偿标准城乡统一试点工作的意见》规定,即日起,山东地区人身损害赔偿纠纷案件(含海事案件)中残疾赔偿金、死亡赔偿金均按照新标准43726元/年进行计算。<br>湖北地区<br><img><br>2021年1月19日,湖北省统计局公布 2020年度湖北省城镇居民人均可支配收入36706元,根据《湖北省高级人民法院关于开展人身损害赔偿标准城乡统一试点工作的通知》(鄂高法(2019)158号)规定,即日起,湖北地区人身损害赔偿案件中残疾赔偿金、死亡赔偿金均按照新标准36706元/年进行计算<br>湖南地区<br><img><br>2021年1月19日,湖南省统计局公布 2020年度湖南省全省居民收入及支出情况,其中城镇居民人均可支配收入41698元、农村居民人均可支配收入16585元,城镇居民人均生活消费支出26796元,农村居民人均生活消费支出14974元。
169593	5G畅爽冰激凌99元档月费99元,套餐包含国内语音400分钟(除港澳台地区外),国内流量20G,国内接听不收费,包含来电显示。,超出套餐后国内语音0.15元/分钟,短信彩信0.1元/条,国内流量3元/G。最多办理2张副卡,副卡月功能费10元/张。
171413	二、打造两个平台,不断深化红色教育的内涵(一)是以深入开展“红色主题活动”为契机,促进革命老区精神薪火传承。红色乡镇要立足红色基地,依托人文优势,通过举行入党入团入少先队宣誓仪式、多媒体教育、“解放战争史”讲座等多种形式,促进革命老区精神薪火传承,树立一批先进模范群体的典型,打造基层党团的鲜亮旗帜,带动优良作风创建,提升思想政治教育水平。围绕着“班子建设好、主题活动好、支部建设好、活动阵地好、特色创新好”这一标准,涌现出一批先进党支部、优秀党务工作者、优秀共产党员、革命老区“边疆文化阵地守护者”先进集体、先进分子。(二)是以扩充革命时期实物为抓手,让革命传统在党员干部群众及青少年中生根发芽。同时在中小学生中开展以红色教育为主题的演讲比赛、作文比赛等活动,引起强烈的反响,收到明显的教育效果。 总而言之,红色老区要积累经验,树立品牌:红色宣讲循序渐进、逐步拓展;红色实践因地制宜、全面覆盖,使红色教育逐渐形成规模,形成传统,形成系列,形成特色。
171414	红色教育,服务于公民道德体系建设、未成年人教育,特别着力于鼓励大专毕业生树立远大的抱负为建设革命老区求学、成才、创业。红色教育,为全社会缅怀历史、坚定信仰、学习老区、支援老区,提供直接的便利与服务。红色教育将帮助革命老区建设红色“数字化网络服务系统”,以便革命老区捕捉发展机遇,运用时代快捷手段,与外部交流互动。红色教育就是对学生进行爱国主义教育和革命传统教育,遵循寓教于乐的原则,结合重大节日和纪念日,对学生开展丰富多彩的“红色教育”。如学校根据不同年龄段学生的特点,进行红色教育的合理分层,细化活动的内容和形式。
171419	维吾尔族木材雕刻文化 维吾尔族信奉伊斯兰教。 传统节日有: 1、古尔邦节:一年一度的最为隆重,信教 群众家家炸油馓子,很多 人家宰羊杀鸡。节日开始 ,男女老幼穿新衣互相拜 节祝贺。 2、肉孜节: 成年的教徒要封斋1个月。封斋期间,只在日 出前和日落后进餐。 期满30天开斋,恢复 白天吃喝的习惯。节日 期间人人都穿新衣服, 戴新帽,相互拜节祝贺。 是维吾尔族人民最古老的传统节日。要举行各种庆祝活动和传统的“麦西莱甫”(歌舞形式), 预祝在新的一年里平安幸福、人丁兴旺、五谷丰 男袍称“袷袢”(qipn 斜领,无纽扣,用长方巾扎腰。 特点:式样宽松、洒脱,色彩对比强烈。 妇女爱穿 宽袖轻盈的 连衣裙,过 去女子多在 裙外套黑色对襟背心。 今多穿西式 短上装和裙 维吾尔族不论男女老幼都戴绣有各种花纹的多帕(花帽)。它色彩绚丽。
171420	“维吾尔”是维吾尔族的自称,意为“团结”或“联 维吾尔族主要聚居在新疆维吾尔自治区天山以南的 喀什、和田一带和阿克苏、 库尔勒地区,其余散居在天 山以北的伊犁等地。 有自己独特的民族语言 文化。 人口:923.50万人,占新疆总人口的45.62% 由来:维吾尔族原是公元三世纪游牧于中国北方和西北贝加尔湖以南、 额尔齐斯河和巴尔喀什湖一带的牧 由于受部落间战争的影响,各个部落的分支逐渐迁徙西域(今新 疆),先后曾被译为“韦纥”、 “畏兀儿”,以后才改为“维吾尔”,沿袭至今, 以农业为主,种植棉花 、小麦、玉米、水稻等 农作物。 此外还擅长园林艺术。 中国最大面积的葡萄 生产基地,即葡萄沟就 在离新疆维吾尔族自治 区首府乌鲁木齐东南184 公里的吐鲁番盆地。 中国最大面积的葡萄生产基地:葡萄沟 宗教习俗 信仰伊斯兰教。
171426	都说这是个看脸的时代,靠脸也是可以吃饭的,当然了,在直播界更是需要看脸的,如今就连游戏主播也是一个比一个帅气,一个比一个靓丽。在如今大火的手游和平精英中,也不乏一些比较帅气的大主播,这些主播不仅仅有着高超的游戏技术,还有一张让人羡慕的英俊脸庞。下面就给大家盘点盘点那些和平精英美男子! 第一位是虎牙的一哥——不求人。作为虎牙的一哥,颜值一直是与实力并存的。因为其游戏技术与颜值都非常高,他还经常参加一些有明星互动的节目。之前还与人气偶像欧阳娜娜一起排位上分,不少网友评论不求人的颜值与当红小鲜肉们都有的一拼。 第二位是晚玉,这也是虎牙和平精英版块的一位人气大主播,虽然人气略孙虎牙一个不求人,但是颜值还是非常能打的,相比冷色系的不求人,晚玉更像是暖色系的暖男,看起来给人一种舒适的感觉。 第三位是职业选手伞兵,不少网友在看到他的第一反应都是:吴奇隆?确实,伞兵立体的五官确实很像吴奇隆,但是看起来更加年轻点,不少粉丝也是因为颜值而粉起了他,在职业选手中也是非常受欢迎的一位。 最后一位就是猫七,相信玩抖音的小伙伴们应该都知道这个主播,在抖音上坐拥900万粉丝,被称为抖音和平精英一哥,能有这么多的粉丝,自然颜值是不低的,作为拥有众多女粉的猫七,一脸清秀的外貌也是非常惹人喜爱。然而就在今晚八点,他也是正式入驻虎牙,除了现场给粉丝发放20万的豪礼,更是与虎牙知名主播鲨鱼哟展开一场土豆雷大战!面对这样一位有颜有实力的新主播入驻,相信不少小伙伴们都非常期待一睹他的风采了吧。今晚八点锁定虎牙平台,一起来看猫七的精彩首秀吧!
171446	暂时不用,等五十多天,可以去医院做B超,抽血检查孕酮值,在医院建党之类的,我之前四十多天去早了,浪费钱
171461	评级钞的单张评级并进行独立封套的行为实际上强化了单张的品相概念。但收藏中最完美也是约定俗成的规矩就是完整成套。这也是纸钞收藏中高境界、高要求。但评级钞则完全打破了这种观念。这时有藏友说那可以整套评级啊。那实际上就中了评级公司的套了。真的有必要连最小面值也去评级吗?但这种做法是评级公司恰恰需要的。<br><img><br>问题四:哪些纸钞可以去评级<br>现在评级钞收藏俨然要成为收藏的主流,没有几张评级钞甚至没有点高分钞都不好意思和别人交流。于是任何纸钞都去评级。这恰恰又出现了收藏了误区。其实不是什么纸钞都有必要去评级的。<br>那么哪些纸钞十分有必要去评级的呢?<br>老精稀纸钞是评级的首选,这些纸币由于年代久远,纸钞更容易被动手脚,即便下清水也会对纸币产生重要影响,而细微的差异有时非专业人员真的很难分辨。比如第一版人民币绝大多数纸币都动过手脚,甚至直接就是假钞。这种难以辨别真伪的而且价值较高的纸币评级币的优势就显现无疑了。<br>个人认为第二版及第三版的部分价值较高的稀少品种有必要进行评级,而有一些券别则没有必要进行评级了。毕竟有些纸币现在基本按刀按捆交易可见其存量巨大。价值不高再评出些低分就没有这个必要了。<br>所以,难以分辨真伪、老精稀、价值高是可否评级的关键几个指标。<br><img><br>问题五:购买评级币需要分数越高越好吗?<br>送评的纸币评分越高越好,但如果直接购买评级钞则没有必要越高越好,想要68分以上的超高分是要付出代价的,而币商就是利用这种追求高分的心理谋取非常高的溢价。比如三版纸钞中的一般品种就根本没必要追求68以上,还是那句老话,成刀成捆的货多得很。绝大多数品种不是高分少,而是现在少而已。<br>有些品种分数低一点反而达到性价比较好的效果,比如三版人民币66分,二版人民币 65分,一版人民币甚至58分以上都算比较好的选择。前提是PMG 一定要带EPQ标志。
