pid	text
359007	<table>早上鱼产卵了,但大部分都被鱼吃了,只抢救出很小一部分,刚才,我拿放大镜观察了一下。有的鱼卵能够看见鱼卵里有小黑点,很明显是眼睛,可有的里面就什么都没有。<br>请问各位,有小黑点的卵是不是就是受精卵呢,是否就能够孵化呢。里面没小黑点的是不是就是没受精的或者是空卵呢,请帮忙说说,谢谢<br><img><br><img><br><img><br>有小黑点的应该就是受精了的<br>没受精的应该会发白.<br>我是别人说的,自家的鱼都是公的,没见过卵<br><img><br><img><br><img><br><img><br>只有在快出鱼的时候才能看到眼睛啊!<br><img><br><img><br><img><br><img><br><img><br><img><br><img><br><img><br><img><br><img><br><img><br><img><br>
359008	早上产的卵,晚上就看见黑点,是不可能的,起码也得第二天,气温在25度左右,当天晚上可看见受精卵变成了透明的小圆圈,而且圆圈里面有一个微黄的小圆圈,那是卵黄.而未受精的卵就变成了不透明的灰白色,最先变白的是卵里的卵黄.<br><img><br><img><br><img><br>发表的“”:<br>早上产的卵,晚上就看见黑点,是不可能的,起码也得第二天,气温在25度左右,当天晚上可看见受精卵变成了透明的小圆圈,而且圆圈里面有一个微黄的小圆圈,那是卵黄.而未受精的卵就变成了不透明的灰白色,最先变白的是卵里的卵黄.<br>还是实践出真知!<br>等我有母寿,她愿意繁殖的时候也实践一下<br><img><br><img><br><img><br><img><br>我也在为这个问题头疼呢!~看了大家的发言大受启发,能不能这么说:如果在产卵后的第二天即24小时后如果卵变为灰白色了就是未受精卵,如果这个时候还没有变白状似透明就是受精卵。能这样理解吗?请大家指教!<br><img><br><img><br><img><br><img><br><img><br><img><br><img><br><img><br><img><br><img><br>发表的“”:<br>我也在为这个问题头疼呢!~看了大家的发言大受启发,能不能这么说:如果在产卵后的第二天即24小时后如果卵变为灰白色了就是未受精卵,如果这个时候还没有变白状似透明就是受精卵。能这样理解吗?请大家指教! [表情]<br>有一个直观的观察法,第二天你如果看到盆地白花花的全是卵,说明您失败了,如果您惊讶的发现了卵怎么全没了,也就是没看见鱼卵,那就是成功了<br><img>,其实受精卵是透明的,没白色,仔细看泛点青色。<br><img><br><img><br><img><br>24~36小时后仍然保持透明的就是受精卵,混浊发白的是死卵。<br><img><br><img><br><img><br><img><br><img><br><img><br><img><br><img><br><img><br><img><br><img><br><img><br><img><br>看见发白的赶紧清除,或者说只要不那么轻盈透亮的就清除。<br>我刚吃了这亏,毁了一盆。<br></table>
359039	做法:　腌口味:　酸甜　难度:　简单　人数:　6人以上　准备时间:　10分钟　烹饪时间:　半天　700克　辅料　50克30克　6克　#腌白萝卜#　的制作步骤　1.　白萝卜　洗净切去根部(皮不用去除)　2.　改刀成大块(不要太小,太小了不脆影响口感)　3.　放入密封罐或者无水无油的密封容器里　4.　小红辣椒切碎放入密封罐　6.　撒上盐　7.　放入冰糖　9.　盖上盖子　10.　摇匀,腌制半天即可食用(冰糖自己会慢慢融化,小的颗粒不用管它)　大师秘籍　1、此泡菜的特点就是快,随腌随吃,需要尽快吃完,泡的太的久了会影响口感也会变质。　小编推荐　本月最值得期待菜谱!现在看还来得及　一直到今年自己筹划端午节粽子,我才知道包粽子是一件极需要耐心的事。选材要好,包粽子的手艺要好,就连煮粽子也极花时间。去开化考察时,看粽娘们手巧,上下翻飞就捆出来一个结结实实的胖粽。看得心痒了,菜菜也跟着粽娘们学了几招。　菜菜美食日记　15489　阅读　糖心蛋的极简做法,5分钟轻松搞定　前段时间微博有人问我糖心蛋怎么做。我一直觉得糖心蛋很好做。好做的原因是有几个极其简单的方法。今天就和大家分享两种。超简单的糖心蛋~　承多猫　20549　阅读　炒饭也能高逼格,黑松露培根炒饭没吃过?过来吃!　对于一切的执着、刁钻甚至死心眼却换来了在日本的舒服体验,和对舌尖上味觉挑剔后的满足感。或许这也是当年《食神》周星星真正想告诉我们的东西,当你喜欢一件事情,哪怕偏执,又怎样呢?　承多猫　19787　阅读　这么做茄子也很好吃　做过鱼香肉子,做过红烧茄子,这次是鱼香茄子,鲜,香,而且下饭!吃茄子的好季节,茄子就是怎么做都好吃,这道鱼香茄子也算是让我的厨艺得到了升华。　朱长江　152074　阅读　
359156	儿菜是很多人都感觉陌生的一种存在,人们不知道它到底是什么菜,更不知道它的营养与食用功效有哪些。而且是一种营养价值极高的绿色蔬菜,它的学名叫抱子芥,是芥菜的一个独特品种。接下来我会带大家走近儿菜,会让大家在了解什么是儿菜的同时,也了解它的营养价值与食用功效。<br><img><br><h2>什么是儿菜</h2><br>儿菜是芥菜的一种,它的长像比较奇特,当它生长到一定的阶段时,会在它的叶叶下继续长出嫩芽,而且会不断膨大,每一棵儿菜在生长过程中会长出15~20个这样的绿色芽块,就像一个母亲身边围着多个孩子一样,人们就依据它的这种特征把它定名为儿菜。它收取以后可以腌制咸菜,也可以炒着吃或者做成凉拌菜。<br><h2>儿菜的营养价值</h2><br>
359157	儿菜口感脆内营养价值极高,它不但含有丰富植物蛋白和多种维生素,还含有丰富的微量元素钙和磷,这些营养物质被人体吸收以后能增强人体免疫力,并能促进人体代谢,提高身体肠胃消化功能。儿菜中还含有丰富的芥子油和挥发油中含有丰富微量元素磷,这些物质可以润肺止咳,消炎杀菌,增强人体的抗病能力。<br><img><br><h2>儿菜的功效</h2><br>1、清热利尿<br>儿菜是一种性质微寒的绿色蔬菜,但含有丰富的水分,还含有一些天然利尿成分,能加快人体内多余水分分解与代谢,并促进人体内尿液生成,它对人类的小便不利,身体浮肿都有良好调理作用。儿菜中还含有丰富的膳食纤维和果胶这些物质能促进肠道蠕动,进入人体以的能清肠排毒预防便秘。<br>2、解毒排毒<br>儿菜中有多种天然解毒成分能加快人体内多种毒素分解和代谢,并能增强人类肝脏的解毒功能,人们食用它以后能阻止毒素在身体内淤积,可以减少毒素对人体细胞的破坏。人们食用儿菜还能吸收丰富的植物蛋白和粘液蛋白他们可以加快人体内免疫球蛋白产生,并能增强人体免疫功能,对提高人体自身抗病能力有很明显的好处。<br>原创:果蔬百科https://z.xiziwang.net
359162	<br><img><br><h3>安装步骤</h3><br>1、下载并解压wifi万能钥匙电脑版安装包压缩包,然后双击运行应用程序,进入安装向导界面,勾选“同意并已阅读wifi万能钥匙pc版的用户许可协议”同意软件相关协议,最后点击“快速安装”或者“自定义安装”<br><img><br>2、小编自己选择的是自定义安装,选择软件安装路径,勾选“创建桌面快捷方式”或者“创建到快速启动栏”,当然你也可以勾选其中的一个,根据自己的需求来勾选,然后点击“立即安装”<br><img><br>3、软件正在安装,安装过程非常迅速,稍微等待几秒钟就可以安装好<br><img><br>4、wifi万能钥匙PC电脑版安装完成,打开软件用户就可以尽情使用了<br><img><br><h3>使用教程</h3><br>很多人在网上搜索wifi万能钥匙怎么用,关于这个现象,小编给大家整理提供了详细的使用教程:<br>一、利用“USB共享网络”方法怎么连接手机<br>1、先打开手机的设置选择“开发者选项”启用“USB调试”<br>2、再用数据线,将手机和电脑连接起来。<br>3、接下来着打开手机的网络连接,选择“更多网络”点击“网络共享与便携热点”<br>4、启用热点之后,手机先放一边。这时我们注意查看一下,WiFi万能锁匙电脑版的左上角,是不是已经显示为“手机已连接”了呢!<br>这说明电脑已经成功共享手机的网络了,接下来点击“一键查询万能锁匙”的按钮。<br>PS:如果连接不上,估计是你没有安装手机驱动,可以借助一些手机助手来安装驱动。<br>1、正在查询中<br>2、好啦!如下图所示、查询到显示有“蓝色小锁匙”的标志后,我们选择需要连接的WiFi ,点击自动连接即可。<br><img><br>3、正在尝试获取中,如下图所示、只要有一丁点的网络,无论是手机版、还是电脑版、都可以轻松获取网络密码。<br>4、如下图所示出现、恭喜,连接热点成功。接下来就可以正常联网了。<br>PS:电脑版连接成功之后,即可拔掉数据线,关闭USB共享。<br><img><br>二、此万能钥匙电脑版利用手机“WLAN热点”怎么连接手机<br>下面这个方法适合,不会安装手机驱动,没有USB共享功能,或者没有数据线、以及手机上没有安装WiFi万能锁匙的情况下使用。其中操作方法同样是,电脑先借助手机的2G/3G网络进行联网,(前提是电脑必须内置有无线网卡)<br>1、同样先进入“网络共享与便携式热点”开启“WLAN热点”<br>2、开启后先点击“设置WLAN热点”在弹出的设置窗口中,我们可以看到“网络SSID”里面的默认热点名称和密码。可以先记起来。如果看不到密码,可以点一下“显示密码”<br>PS:为了方记住和便于查找,你也可以修改一下名称和密码,如:我的是YLD<br>1、接下来双击电脑右下角的“无线网络”在无线网络这里刷新一下,就可以看手机的热点名称了,然后右键选择“连接”<br>2、此时在键入安全密锁框里,输入刚刚我们在手机上开启的“热点密码”进行连接<br>3、接下来打开“WiFi万能锁匙电脑版”看看是不是已经连接了手机WLAN热点。然后继续点击“一键查询万能锁匙”<br>PS:是否成功联网,你也可以打开网页测试一下便知,不过会消耗大流量哦。<br>查询到“蓝色锁匙标志”后同样点击“自动连接”即可。<br>1、如下图所示、正在尝试获取网络密码中、如果网络中断,可以重新获取。<br><img><br>经过多次测试,利用WLAN热点获取网络密锁,可能会出现掉线、网络不稳定的情况,远比不上用USB共享获取的快。<br>2、如下图所示、好啦!恭喜你,WiFi连接成功。接下来切记,要马上关闭手机的“WLAN热点”不然会跑流量的哦!<br><img><br><h3>使用心得</h3><br>就笔者的体验而言,此万能钥匙电脑版的使用很简单,首先你的电脑需要支持无线网络。笔记本一般都支持,而台式机的话可能需要购买无线网卡。安装此万能钥匙电脑版后,开启软件,就可以探测周边可以连接的WiFi了。你可以连接可用的WiFi,也可以把已有的WiFi分享给他人。当然,如果不想被蹭网的话,就不要把WiFi分享给他人了,不然别人用此万能钥匙电脑版,也可以连接你家里的WiFi!简而言之,这是一款很有共产主义精神的软件,如果不想让别人用你家的WiFi,那你也不要用此万能钥匙电脑版来连接别人的WiFi,免费WiFi是需要共享精神的。<br><h3>功能特色</h3><br>一、首创WiFi安全防护三角矩阵:全方位保障上网安全,4亿+免费WiFi热点无忧一键连接<br>1、安全云感知:提前预知风险<br>2、安全隧道加密:实时保障安全<br>3、WiFi安全险:快速安全理赔<br>二、WiFi安全云感知系统,提前预知风险<br>自研开发WiFi安全云感知系统,利用大数据追踪,此万能钥匙电脑版对WiFi热点进行全方位的安全评估,在连接前,针对风险WiFi做出预警,帮助用户提前预知风险,同时系统自学习能力,能够对预判到的风险WiFi热点进行智能追踪,及时调整判断,从而避免误判断,提高预警准确率。<br>三、安全隧道保护系统,实时保障上网安全<br>用户上网安全是我们的产品生命线,为保证用户使用此万能钥匙上网安全,我们开发了安全隧道保护系统,对用户上网中的信息传输进行加密,保证用户隐私安全。 同时其智能体检功能可以在用户上网过程中,实时对钓鱼、ARP攻击、DNS篡改等网络攻击行为进行监测,并采取底层驱动级防护。我们所有的努力,只为你的上网安全。<br>四、千万上网险,快速安全理赔<br>2015年9月,我们与众安保险一起推出了行业首个千万级保额WiFi安全险,用户及热点主人使用此万能钥匙电脑版时,如因使用发生财产非正常损失,可以凭借相关材料向众安保险提出理赔申请,WiFi安全险会提供单笔最高10万元保险理赔金。
363372	儿菜<br>儿菜学名抱子芥,是十字花科芸薹属的一个变种,富含钙、铁、磷、维生素等,多食可清败火、去油腻,品质细嫩、吃法多样,是上佳的保健蔬菜.璧山地区种植儿菜已有 40 年历史,是璧南片区冬春蔬菜的主栽品种,年种植面积超过2500hm2,产量超过 10 万t,主销重庆、四川、贵州、广东等地.<br>儿菜营养丰富,品质细嫩,味道鲜美,吃法多样,炒、烩、炸、涮、凉拌、作汤、腌泡均可,具有清热败火,去油腻等保健食疗效果,是宴宾席上的美味佳肴。
365117	被动加d<br>1年前
365227	<br>你好,其实,恶性肿瘤就是我们平时所说的癌症。当人体的内细胞发生突变之后,它就会不断地分裂,不受身体的控制,最后形成癌症。我们身体内所有器官都是由细胞组成,在正常的情况下,细胞增长和分化能够满足身体需要,这种有序的过程可保持我们身体健康。然而,如果细胞继续分裂,这些额外的大量细胞就形成肿瘤。因此,恶性肿瘤就是癌症的另一种说法。我们在这里建议大家,平时一定要注意讲究卫生,加强锻炼,吃有营养的食物,才能有效预防癌症的出现。
365815	苋菜富含膳食纤维,常食可以减肥轻身,促进排毒,防止便秘。同时常吃苋菜可增强体质,所含比茄果类高,有“长寿菜”之称。苋菜能促进儿童生长发育,其铁、钙的含量高于菠菜,为鲜蔬菜中的佼佼者。亦适宜于贫血患者、妇女和老年人食用,维持正常心肌活动,促进凝血、造血和血液携带氧气的功能。<br>儿菜的营养价值有哪些?<br>儿茶精有抗放射、升高白细胞和抗肿瘤作用,并因能抑制瘤细胞与纤维蛋白粘连而阻止瘤细胞扩散<br>什么蔬菜营养价值比较高<br>土豆<br>采纳哦<br>那种蔬菜营养价值最高?<br>
365816	营养价值每100克可含水分90.1克,蛋白质1.8克,脂肪O.3克,碳水化合物5.4克,粗纤维0.8克,灰分1.6克,胡萝卜素1.95毫克,维生素马0.04毫克,维生素马0.16毫克,尼克酸1.1毫克,维生素C28毫克,钙180毫克,磷46毫克,铁3.4毫克,钾577毫克,钠23毫克,镁87.7毫克,氯160毫克。苋菜苋菜叶富含易被人体吸收的钙质,对牙齿和骨骼的生长可起到促进作用,并能维持正常的心肌活动,防止肌内痉挛。同时含有丰富的铁、钙和维生素K,可以促进凝血。
372224	下面是一个分步指南,适用对了解 Python 感兴趣并使用 Windows 10 的初学者。<br><h2>设置开发环境</h2><br>对于不熟悉 Python 的初学者,建议从 Microsoft Store 安装 Python。 通过 Microsoft Store 安装会使用基本 Python3 解释器,但会为当前用户设置 PATH 设置(避免需要管理员访问权限),以及提供自动更新。 如果处于教育环境中或所属组织限制计算机上的权限或管理访问权限,则这会特别有用。<br>如果在 Windows 上将 Python 用于 Web 开发,则建议为开发环境设置其他设置。 建议通过适用于 Linux 的Windows 子系统安装和使用 Python,而不是直接在 Windows 上安装。 有关帮助,请参阅:开始在 Windows 上将 Python 用于 Web 开发。 如果对在操作系统上自动执行常见任务感兴趣,请参阅我们的指南:开始在 Windows 上将 Python 用于脚本和自动化。 对于某些高级方案(如需要访问/修改 Python 的已安装文件、创建二进制文件的副本或直接使用 Python DLL),可能需要考虑直接从python.org 下载特定 Python 版本或考虑安装替代实现,如Anaconda、Jython、PyPy、WinPython、IronPython 等。建议仅当你是更高级的 Python 程序员并且有特定原因需要选择替代实现时才使用此方法。<br><h2>安装 Python</h2><br>使用 Microsoft Store 安装 Python:<br>转到“开始” 菜单(左下方 Windows 图标),输入“Microsoft Store”,选择用于打开应用商店的链接。<br>应用商店打开后,从右上方菜单中选择“搜索”,然后输入“Python”。 在“应用”下,从结果中选择要使用的 Python 版本。 我们建议使用最新的版本,除非有理由不这样做(例如与计划处理的预先存在项目上使用的版本保持一致)。 确定要安装的版本后,请选择“获取”。<br>Python 完成下载和安装过程后,使用“开始”菜单(左下方 Windows 图标)打开 Windows PowerShell。 PowerShell 打开后,输入Python --version以确认已在计算机上安装了 Python3。<br>Python 的Microsoft Store 安装包括 pip(标准包管理器)。 通过 pip 可以安装和管理不属于 Python 标准库的其他包。 若要确认还可使用 pip 安装和管理包,请输入pip --version。<br><h2>安装 Visual Studio Code</h2><br>通过使用 VS Code 作为文本编辑器/集成开发环境 (IDE),可以利用IntelliSense(代码完成辅助)、Linting(可帮助避免在代码中发生错误)、调试支持(可帮助在运行代码之后查找代码中的错误)、代码片段(小型可重用代码块的模板)以及单元测试(使用不同类型的输入测试代码的接口)。<br>VS Code 还包含一个内置终端,使你可以使用 Windows 命令提示符、PowerShell 或是所喜欢的任何工具打开 Python 命令行,从而在代码编辑器与命令行之间建立无缝工作流。<br>若要安装 VS Code,请下载适用于 Windows 的VS Code:https://code.visualstudio.com。<br>安装 VS Code 以后,还需安装 Python 扩展。 若要安装 Python 扩展,可以选择VS Code 市场链接,也可以打开 VS Code 并在扩展菜单中搜索Python(Ctrl+Shift+X)。
373790	济宁美开乐技校什么时候建立的?实力怎么样?济宁美开乐技校成立于1990年,开办至今一直努力打造文明诚信、勤奋自强的职业培训学校,让在这里学习的学生都能学到专业的知识和技能,毕业时能够骄傲的走出校门、进入社会。而事实上,济宁美开乐技校也做到了这一目标,并且得到了学生、家长和社会的广泛认可。下面就为大家详细介绍一下这所学校。<br><img><br>济宁美开乐技校简介<br>济宁美开乐技校是济宁市人力资源和社会保障局批准成立的大型职业培训学校。学校始建于1990年,济宁美开乐技校始终本着“诚信办学、质量兴校”的办学精神,采用先进的“二元”管理模式,在教学上实施“技能+素质”一体化教育,一方面注重学生技能的培养,为学生提供更多的实践机会;另一方面重视学生综合素质教育,培养学生成为符合社会需要的复合型、专业型人才。<br>济宁美开乐技校所获荣誉<br>学校经过三十多年的发展,济宁美开乐技校得到了社会各界的认可,在山东省享有较高的知名度并树立了良好的社会形象,办学信誉卓著。学校连续十年被评为“山东省阳光工程先进培训基地”,被政府评为济宁市城区“青春创业行动”培训基地、“再就业定点培训单位”、“济宁市退役军人培训基地”、“济宁市残疾人职业技能培训基地”、“济宁市下岗职工培训基地”、“任城区妇女创业就业培训基地”“济宁市高技能人才培训基地”、济宁市政府“创业再就业培训基地”、“济宁市任城区电子商务培训基地”、“爱心企业”、“全国美业最具影响力培训学校”,且获得“全省职业教育先进单位”荣誉称号。
375694	胆碱的确对大脑有一定作用。胆碱广泛存在于各种食物中,它在食物中主要以卵磷脂的形式存在于各类食物的细胞膜中.在奶类、肝脏、蛋类、花生、麦胚、大豆中含量很丰富。也说明食物中富含胆碱,所以一般不需要特殊补充。
377261	01<br>孙燕<br>中国工程院院士、临床肿瘤学家,国家癌症中心(NCC)国家新药(抗肿瘤)临床研究中心主任。现任中国医学科学院肿瘤医院肿瘤内科主任医师,曾获得“中国肿瘤内科杰出贡献奖”。数年来,这位肿瘤科专家在发展专业、学科,推广综合治疗,开发抗肿瘤新药与中西医结合研究和培养专业人才方面卓有贡献,他应用现代科学方法阐明扶正了中药的免疫调控作用。<br>02<br>于金明<br>中国工程院院士。山东省肿瘤医院院长,肿瘤放射治疗科主任医师,2017年度“国之名医”大型评选活动获奖医师。于金明从事肿瘤放射治疗30余年,在国内率先开展了立体定向放疗、适形调强放疗等多项新技术,近年来带领他的团队创造性地率先开展影像引导的放疗、生物靶向放疗等新技术,在突破制约放疗疗效的两大瓶颈:精确施照和精确靶区勾画方面作出了突出贡献。<br>03<br>管忠震<br>肿瘤专家排名前十,中山医科大学肿瘤医院肿瘤内科首席专家,擅长诊治儿童期肿瘤、肺癌等多种疾病,曾获“中国肿瘤内科杰出贡献奖”。管忠震教授是我国肿瘤内科学资深学科带头人,也是我国最著名的淋巴瘤专家。从上世纪70年代起,我国肿瘤内科领域就有“北孙南管”之说,意即北有中国医学科学院肿瘤医院孙燕,南有中山医学院附属肿瘤医院管忠震。<br>04<br>周际昌<br>中国医学科学院肿瘤医院肿瘤内科主任医师,“中国肿瘤内科杰出贡献奖”获得者,居肿瘤专家排名榜前十。周际昌有65年的从医经验,对乳腺癌、淋巴瘤、骨髓瘤、肺癌、胃癌、肠癌等的化疗及综合治疗有丰富的临床经验。擅长乳腺癌的联合化疗和早期癌的辅助化疗、大剂量顺铂疗法,以及新抗癌药、升血药和止吐药的研究,对多种肿瘤治疗取得良好效果。<br>05<br>徐惠绵<br>中国医科大学附属第一医院肿瘤外科主任医师,中华肿瘤学会常委,中国医师行业最高奖“中国医师奖”得主。徐惠绵在胃肠癌转移的诊断及治疗方面取得了显著成绩;擅长胃癌、大肠癌、乳腺癌的诊治,以及胃肠癌根治手术、保存植物神经直肠癌切除术、低拉直肠癌保留肛门手术、直肠癌全系膜切除、胃肠癌围手术期综合治疗。其曾获国家/省部级科技进步奖5项。<br>06<br>夏廷毅<br>中国人民解放军空军总医院肿瘤医院院长、肿瘤放射治疗科主任医师,兼任解放军总医院放疗科主任、主任医师。2017年度“国之名医”大型评选活动获奖医师,居肿瘤专家排名前十。夏廷毅从事肿瘤放疗临床工作30年,率先对我国体部伽马刀放射外科技术进行深入研究和临床应用,独创剂量模式治疗早期肺癌、肝癌和胰腺癌等获得显著疗效,在国际上被称为“中国模式”。<br>07<br>贾立群<br>“西医+中医肿瘤专家”贾立群,是中日友好医院中西医结合肿瘤科主任、主任医师,是2018年度“国之名医”大型评选活动获奖医师。身为国家临床重点专科建设单位负责人、中华预防医学会中西医结合分会主任委员,贾立群率先建立国家中西医结合肿瘤专科医联体;建立中医外治防治肿瘤并发症技术体系;建立食管癌临床路径、在食管癌高发区建立舌象大数据研究平台。<br>08<br>卢冰<br>贵州医科大学附属医院肿瘤科专家、主任医师,贵州省肿瘤医院副院长兼肿瘤科主任。2018年度“国之名医”大型评选活动获奖医师。卢冰注重强调“规范中创新、科研指导临床”,他长期专业从事胸部肿瘤非手术治疗临床及研究工作,尤其是“IV期非小细胞肺癌精确放射治疗临床研究和应用”成果填补了国内空白,荣获2017年度国家科学技术进步奖二等奖。<br>09<br>李进<br>上海市东方医院南院肿瘤科名医、主任医师,2019年度“国之名医”大型评选活动获奖医师。李进有30余年临床工作经验,他先后牵头开展了百余项大型国际多中心临床研究,在我国肿瘤创新性新药临床研究领域有较高造诣,获得国家科技进步奖二等奖、教育部科技进步二等奖。现在还担任中国临床肿瘤学会(CSCO)理事长、亚洲肿瘤联盟(FACO)主席等职。<br>10<br>浙江医科大学附属第二医院副院长、肿瘤科主任医师,“赛克勒中国医师年度奖”获得者。
